{
  "schema": "../contracts/dependency-graph.schema.json",
  "graph_id": "FORGE_DEPENDENCY_GRAPH_002",
  "source_artifacts": [
    "scaffolds/manifest/forge-module-registry.json",
    "scaffolds/manifest/forge-product-surfaces.json",
    "scaffolds/manifest/rewrite-stages.json",
    "scaffolds/manifest/requirements-traceability.json",
    "scaffolds/manifest/constitutional-boundaries.json"
  ],
  "topological_order": [
    "MOD-AUTONOMOUS-AI-DECISIONING",
    "MOD-GENERIC-CRM-CLONE",
    "MOD-TRUTH-GOVERNANCE",
    "MOD-DECISION-CORE",
    "MOD-GOVERNANCE-GATE",
    "MOD-ACTION-PLANNING",
    "MOD-LEGACY-REINTRODUCTION-GUARD",
    "MOD-TERMUX-REWRITE-TOOLS",
    "MOD-CARRIER-SCOPE",
    "MOD-HUMAN-APPROVAL-GATE",
    "MOD-LEGACY-FUNCTIONAL-EVIDENCE-INTAKE",
    "MOD-READONLY-ADAPTERS",
    "MOD-ADVISOR-LIFECYCLE",
    "MOD-CLIENT-CRM-READMODEL",
    "MOD-MICK-BEHAVIOR",
    "MOD-OPPORTUNITY-PIPELINE",
    "MOD-POLICY-OPERATIONS",
    "MOD-PRODUCT-CATALOG",
    "MOD-RULE-PACK-CONTRACT",
    "MOD-ADVISOR-CONVERSION",
    "MOD-ADVISOR-EXPERIENCE",
    "MOD-CALCULATION-CONTRACT",
    "MOD-ELIGIBILITY-CONTRACT",
    "MOD-MANAGER-COACHING",
    "MOD-PRODUCT-SOURCE-PACK",
    "MOD-RELATIONSHIP-INTELLIGENCE",
    "MOD-ADVISOR-ACTIVATION",
    "MOD-COMPENSATION-ECONOMIC",
    "MOD-CONVERSATION-INTELLIGENCE",
    "MOD-MANAGER-WORKSPACE",
    "MOD-QUOTE-PREVIEW",
    "MOD-RECRUITMENT-PRECONTRACT",
    "MOD-ADVISOR-WORKSPACE",
    "MOD-LLM-DRAFT-INTAKE",
    "MOD-NBA-REASON-WHY",
    "MOD-REVENUE-INTELLIGENCE",
    "MOD-MESSAGE-SAFETY-VALIDATOR"
  ],
  "active_topological_order": [
    "MOD-TRUTH-GOVERNANCE",
    "MOD-DECISION-CORE",
    "MOD-GOVERNANCE-GATE",
    "MOD-ACTION-PLANNING",
    "MOD-LEGACY-REINTRODUCTION-GUARD",
    "MOD-TERMUX-REWRITE-TOOLS",
    "MOD-CARRIER-SCOPE",
    "MOD-HUMAN-APPROVAL-GATE",
    "MOD-READONLY-ADAPTERS",
    "MOD-ADVISOR-LIFECYCLE",
    "MOD-CLIENT-CRM-READMODEL",
    "MOD-MICK-BEHAVIOR",
    "MOD-OPPORTUNITY-PIPELINE",
    "MOD-POLICY-OPERATIONS",
    "MOD-PRODUCT-CATALOG",
    "MOD-RULE-PACK-CONTRACT",
    "MOD-ADVISOR-CONVERSION",
    "MOD-ADVISOR-EXPERIENCE",
    "MOD-CALCULATION-CONTRACT",
    "MOD-ELIGIBILITY-CONTRACT",
    "MOD-MANAGER-COACHING",
    "MOD-PRODUCT-SOURCE-PACK",
    "MOD-RELATIONSHIP-INTELLIGENCE",
    "MOD-ADVISOR-ACTIVATION",
    "MOD-CONVERSATION-INTELLIGENCE",
    "MOD-MANAGER-WORKSPACE",
    "MOD-QUOTE-PREVIEW",
    "MOD-ADVISOR-WORKSPACE",
    "MOD-LLM-DRAFT-INTAKE",
    "MOD-NBA-REASON-WHY",
    "MOD-MESSAGE-SAFETY-VALIDATOR"
  ],
  "cycles": [],
  "critical_path": {
    "modules": [
      "MOD-TRUTH-GOVERNANCE",
      "MOD-DECISION-CORE",
      "MOD-ACTION-PLANNING",
      "MOD-HUMAN-APPROVAL-GATE",
      "MOD-ADVISOR-LIFECYCLE",
      "MOD-RELATIONSHIP-INTELLIGENCE",
      "MOD-CONVERSATION-INTELLIGENCE",
      "MOD-LLM-DRAFT-INTAKE",
      "MOD-MESSAGE-SAFETY-VALIDATOR"
    ],
    "edges": [
      {
        "from": "MOD-TRUTH-GOVERNANCE",
        "to": "MOD-DECISION-CORE",
        "dependency_edge": "MOD-DECISION-CORE->MOD-TRUTH-GOVERNANCE",
        "type": "SECURITY"
      },
      {
        "from": "MOD-DECISION-CORE",
        "to": "MOD-ACTION-PLANNING",
        "dependency_edge": "MOD-ACTION-PLANNING->MOD-DECISION-CORE",
        "type": "HARD"
      },
      {
        "from": "MOD-ACTION-PLANNING",
        "to": "MOD-HUMAN-APPROVAL-GATE",
        "dependency_edge": "MOD-HUMAN-APPROVAL-GATE->MOD-ACTION-PLANNING",
        "type": "HARD"
      },
      {
        "from": "MOD-HUMAN-APPROVAL-GATE",
        "to": "MOD-ADVISOR-LIFECYCLE",
        "dependency_edge": "MOD-ADVISOR-LIFECYCLE->MOD-HUMAN-APPROVAL-GATE",
        "type": "SECURITY"
      },
      {
        "from": "MOD-ADVISOR-LIFECYCLE",
        "to": "MOD-RELATIONSHIP-INTELLIGENCE",
        "dependency_edge": "MOD-RELATIONSHIP-INTELLIGENCE->MOD-ADVISOR-LIFECYCLE",
        "type": "HARD"
      },
      {
        "from": "MOD-RELATIONSHIP-INTELLIGENCE",
        "to": "MOD-CONVERSATION-INTELLIGENCE",
        "dependency_edge": "MOD-CONVERSATION-INTELLIGENCE->MOD-RELATIONSHIP-INTELLIGENCE",
        "type": "HARD"
      },
      {
        "from": "MOD-CONVERSATION-INTELLIGENCE",
        "to": "MOD-LLM-DRAFT-INTAKE",
        "dependency_edge": "MOD-LLM-DRAFT-INTAKE->MOD-CONVERSATION-INTELLIGENCE",
        "type": "HARD"
      },
      {
        "from": "MOD-LLM-DRAFT-INTAKE",
        "to": "MOD-MESSAGE-SAFETY-VALIDATOR",
        "dependency_edge": "MOD-MESSAGE-SAFETY-VALIDATOR->MOD-LLM-DRAFT-INTAKE",
        "type": "HARD"
      }
    ],
    "length": 8,
    "start_module": "MOD-TRUTH-GOVERNANCE",
    "end_module": "MOD-MESSAGE-SAFETY-VALIDATOR",
    "total_weight": 8
  },
  "rejected_modules": [
    "MOD-AUTONOMOUS-AI-DECISIONING",
    "MOD-GENERIC-CRM-CLONE"
  ],
  "deferred_modules": [
    "MOD-COMPENSATION-ECONOMIC",
    "MOD-LEGACY-FUNCTIONAL-EVIDENCE-INTAKE",
    "MOD-RECRUITMENT-PRECONTRACT",
    "MOD-REVENUE-INTELLIGENCE"
  ],
  "modules": [
    {
      "id": "MOD-DECISION-CORE",
      "name": "Decision Core",
      "graph_membership": "INCLUDED",
      "definition_readiness": "DEFINED",
      "scaffold_readiness": "READY",
      "implementation_readiness": "READY",
      "execution_readiness": "COMPLETED",
      "validation_readiness": "READY",
      "promotion_readiness": "BLOCKED",
      "build_disposition": "EXISTS_PRESERVE",
      "stage_id": "SG-002",
      "required_contracts": [
        "scaffolds/contracts/scaffold-contract.schema.json"
      ],
      "required_capabilities": [
        "CAP-DECISION-CORE"
      ],
      "required_schemas": [
        "scaffolds/contracts/scaffold-contract.schema.json"
      ],
      "required_services": [
        "MOD-TRUTH-GOVERNANCE"
      ],
      "required_infrastructure": [],
      "required_storage": [],
      "constitutional_boundaries": [
        "BOUND-EVIDENCE-OWNERSHIP"
      ],
      "adr_references": [
        "ADR-001",
        "ADR-002",
        "ADR-003",
        "ADR-004",
        "ADR-020"
      ],
      "producer_modules": [
        "MOD-TRUTH-GOVERNANCE"
      ],
      "consumer_modules": [
        "MOD-ACTION-PLANNING",
        "MOD-ADVISOR-WORKSPACE"
      ],
      "blocking_modules": [],
      "optional_modules": [],
      "future_modules": [],
      "dependencies": [
        {
          "module_id": "MOD-TRUTH-GOVERNANCE",
          "type": "SECURITY",
          "required_for": [
            "SCAFFOLD",
            "IMPLEMENT",
            "VALIDATE",
            "PROMOTE"
          ],
          "direction": "MOD-DECISION-CORE->MOD-TRUTH-GOVERNANCE"
        }
      ],
      "build_events_published": [
        "mod.decision.core.contract_ready"
      ],
      "build_events_consumed": [
        "mod.truth.governance.contract_ready"
      ],
      "domain_events_published": [
        "decision.result.proposed"
      ],
      "domain_events_consumed": [],
      "integration_events_published": [],
      "integration_events_consumed": [],
      "audit_events": [
        "mod.decision.core.audit.recorded"
      ],
      "forbidden_events": [],
      "evidence_sources": [
        "platform/core/decision/"
      ],
      "implementation_locations": [
        "platform/core/decision/"
      ],
      "observed_artifacts": [
        "platform/core/decision/"
      ],
      "blocking_conditions": [],
      "promotion_gate_id": "MOD-DECISION-CORE-PROMOTION-GATE",
      "promotion_gate_state": "NOT_EVALUATED",
      "promotion_requirements": [
        "contracts_valid",
        "evidence_present",
        "dependency_graph_valid",
        "rollback_defined",
        "owner_approval_if_required"
      ],
      "rollback_strategy": "REMOVE_GENERATED_FILES_AND_EVIDENCE_IF_HASHES_MATCH",
      "rollback_checkpoint": "MOD-DECISION-CORE-pre-apply",
      "rollback_scope": [
        "generated_files",
        "stage_evidence",
        "local_execution_state"
      ],
      "rollback_preconditions": [
        "uncommitted stage or hash match"
      ],
      "rollback_impacted_modules": [
        "MOD-ACTION-PLANNING",
        "MOD-ADVISOR-WORKSPACE"
      ],
      "rollback_restores_commit": false,
      "rollback_evidence": "scaffolds/reports/SG-002-rollback-evidence.json",
      "topological_index": 2,
      "execution_wave": 2,
      "dependency_depth": 2,
      "active_priority": null
    },
    {
      "id": "MOD-ACTION-PLANNING",
      "name": "Action Planning",
      "graph_membership": "INCLUDED",
      "definition_readiness": "DEFINED",
      "scaffold_readiness": "READY",
      "implementation_readiness": "READY",
      "execution_readiness": "COMPLETED",
      "validation_readiness": "READY",
      "promotion_readiness": "BLOCKED",
      "build_disposition": "EXISTS_PRESERVE",
      "stage_id": "SG-002",
      "required_contracts": [
        "scaffolds/contracts/scaffold-contract.schema.json"
      ],
      "required_capabilities": [
        "CAP-ACTION-PLANNING"
      ],
      "required_schemas": [
        "scaffolds/contracts/scaffold-contract.schema.json"
      ],
      "required_services": [
        "MOD-DECISION-CORE"
      ],
      "required_infrastructure": [],
      "required_storage": [],
      "constitutional_boundaries": [
        "BOUND-ACTION-NO-EXECUTION"
      ],
      "adr_references": [
        "ADR-003",
        "ADR-009",
        "ADR-012"
      ],
      "producer_modules": [
        "MOD-DECISION-CORE"
      ],
      "consumer_modules": [
        "MOD-ADVISOR-EXPERIENCE",
        "MOD-ADVISOR-WORKSPACE",
        "MOD-HUMAN-APPROVAL-GATE",
        "MOD-OPPORTUNITY-PIPELINE",
        "MOD-RELATIONSHIP-INTELLIGENCE"
      ],
      "blocking_modules": [],
      "optional_modules": [],
      "future_modules": [],
      "dependencies": [
        {
          "module_id": "MOD-DECISION-CORE",
          "type": "HARD",
          "required_for": [
            "IMPLEMENT",
            "VALIDATE",
            "PROMOTE"
          ],
          "direction": "MOD-ACTION-PLANNING->MOD-DECISION-CORE"
        }
      ],